[
  {
    "id": "normal_01",
    "nameKo": "돌조각 몽둥이",
    "nameEn": "Stone-Shard Club",
    "grade": "normal",
    "stage": 1,
    "attackPower": 10,
    "successRate": 0.9,
    "failRate": 0.1,
    "failureRewardGroup": "normal_early",
    "nextWeaponId": "normal_02",
    "purchaseUnlockRequired": true,
    "description": "거친 돌조각을 묶어 만든 원시적인 둔기."
  },
  {
    "id": "normal_02",
    "nameKo": "탄화된 송곳",
    "nameEn": "Carbonized Awl",
    "grade": "normal",
    "stage": 2,
    "attackPower": 14,
    "successRate": 0.85,
    "failRate": 0.15,
    "failureRewardGroup": "normal_early",
    "nextWeaponId": "normal_03",
    "purchaseUnlockRequired": true,
    "description": "불에 그을린 끝이 날카롭게 남은 송곳."
  },
  {
    "id": "normal_03",
    "nameKo": "녹슨 칼날편",
    "nameEn": "Rustblade Shard",
    "grade": "normal",
    "stage": 3,
    "attackPower": 18,
    "successRate": 0.8,
    "failRate": 0.2,
    "failureRewardGroup": "normal_mid",
    "nextWeaponId": "normal_04",
    "purchaseUnlockRequired": true,
    "description": "부서진 칼날을 이어 붙인 날카로운 파편."
  },
  {
    "id": "normal_04",
    "nameKo": "비틀린 척추목검",
    "nameEn": "Twisted Spine Sword",
    "grade": "normal",
    "stage": 4,
    "attackPower": 23,
    "successRate": 0.72,
    "failRate": 0.28,
    "failureRewardGroup": "normal_mid",
    "nextWeaponId": "normal_05",
    "purchaseUnlockRequired": true,
    "description": "척추처럼 굽은 나무 결이 드러난 목검."
  },
  {
    "id": "normal_05",
    "nameKo": "깨진 손잡이 검",
    "nameEn": "Broken-Hilt Sword",
    "grade": "normal",
    "stage": 5,
    "attackPower": 29,
    "successRate": 0.65,
    "failRate": 0.35,
    "failureRewardGroup": "normal_mid",
    "nextWeaponId": "normal_06",
    "purchaseUnlockRequired": true,
    "description": "손잡이가 여러 번 수리된 불완전한 검."
  },
  {
    "id": "normal_06",
    "nameKo": "그을린 뼛대검",
    "nameEn": "Sootbone Sword",
    "grade": "normal",
    "stage": 6,
    "attackPower": 36,
    "successRate": 0.58,
    "failRate": 0.42,
    "failureRewardGroup": "normal_late",
    "nextWeaponId": "normal_07",
    "purchaseUnlockRequired": true,
    "description": "뼈와 철편이 섞인 이상한 균형의 검."
  },
  {
    "id": "normal_07",
    "nameKo": "원한의 쐐기검",
    "nameEn": "Grudge Wedge",
    "grade": "normal",
    "stage": 7,
    "attackPower": 44,
    "successRate": 0.5,
    "failRate": 0.5,
    "failureRewardGroup": "normal_late",
    "nextWeaponId": "normal_08",
    "purchaseUnlockRequired": true,
    "description": "쐐기처럼 박히는 짧고 무거운 검."
  },
  {
    "id": "normal_08",
    "nameKo": "검은 가시봉",
    "nameEn": "Black Thorn Rod",
    "grade": "normal",
    "stage": 8,
    "attackPower": 53,
    "successRate": 0.42,
    "failRate": 0.58,
    "failureRewardGroup": "normal_late",
    "nextWeaponId": "normal_09",
    "purchaseUnlockRequired": true,
    "description": "검이라기보다 가시가 돋은 쇠봉에 가깝다."
  },
  {
    "id": "normal_09",
    "nameKo": "탄흔 장검",
    "nameEn": "Scorched Longsword",
    "grade": "normal",
    "stage": 9,
    "attackPower": 63,
    "successRate": 0.35,
    "failRate": 0.65,
    "failureRewardGroup": "normal_late",
    "nextWeaponId": "normal_10",
    "purchaseUnlockRequired": true,
    "description": "불에 타고 다시 식은 흔적이 남은 장검."
  },
  {
    "id": "normal_10",
    "nameKo": "봉인 직전의 검",
    "nameEn": "Sword Before Seal",
    "grade": "normal",
    "stage": 10,
    "attackPower": 75,
    "successRate": 0.28,
    "failRate": 0.72,
    "failureRewardGroup": "normal_final",
    "nextWeaponId": "rare_01",
    "purchaseUnlockRequired": true,
    "description": "다음 등급으로 넘어가기 직전의 불안정한 검."
  },
  {
    "id": "rare_01",
    "nameKo": "흑옥 비수",
    "nameEn": "Black-Jade Dagger",
    "grade": "rare",
    "stage": 1,
    "attackPower": 92,
    "successRate": 0.45,
    "failRate": 0.55,
    "failureRewardGroup": "rare_early",
    "nextWeaponId": "rare_02",
    "purchaseUnlockRequired": true,
    "description": "흑옥의 차가운 광택이 나는 짧은 비수."
  },
  {
    "id": "rare_02",
    "nameKo": "청흑 저주검",
    "nameEn": "Blue-Black Cursed Sword",
    "grade": "rare",
    "stage": 2,
    "attackPower": 108,
    "successRate": 0.4,
    "failRate": 0.6,
    "failureRewardGroup": "rare_early",
    "nextWeaponId": "rare_03",
    "purchaseUnlockRequired": true,
    "description": "저주 문양이 희미하게 떠오르는 검."
  },
  {
    "id": "rare_03",
    "nameKo": "원한의 척추검",
    "nameEn": "Grudge Spine Sword",
    "grade": "rare",
    "stage": 3,
    "attackPower": 126,
    "successRate": 0.35,
    "failRate": 0.65,
    "failureRewardGroup": "rare_mid",
    "nextWeaponId": "rare_04",
    "purchaseUnlockRequired": true,
    "description": "척추를 연상시키는 굴곡이 있는 검."
  },
  {
    "id": "rare_04",
    "nameKo": "흑옥 파편도",
    "nameEn": "Jade Shard Saber",
    "grade": "rare",
    "stage": 4,
    "attackPower": 146,
    "successRate": 0.3,
    "failRate": 0.7,
    "failureRewardGroup": "rare_mid",
    "nextWeaponId": "rare_05",
    "purchaseUnlockRequired": true,
    "description": "흑옥 조각이 칼날처럼 박힌 도."
  },
  {
    "id": "rare_05",
    "nameKo": "봉인된 갈고리검",
    "nameEn": "Sealed Hook Sword",
    "grade": "rare",
    "stage": 5,
    "attackPower": 168,
    "successRate": 0.25,
    "failRate": 0.75,
    "failureRewardGroup": "rare_mid",
    "nextWeaponId": "rare_06",
    "purchaseUnlockRequired": true,
    "description": "휘어져 갈고리처럼 보이는 검."
  },
  {
    "id": "rare_06",
    "nameKo": "그림자 먹는 쌍날",
    "nameEn": "Shadow-Eater Twin Blade",
    "grade": "rare",
    "stage": 6,
    "attackPower": 192,
    "successRate": 0.2,
    "failRate": 0.8,
    "failureRewardGroup": "rare_late",
    "nextWeaponId": "rare_07",
    "purchaseUnlockRequired": true,
    "description": "그림자를 삼키는 듯한 검은 쌍날."
  },
  {
    "id": "rare_07",
    "nameKo": "심연의 쐐기",
    "nameEn": "Abyssal Wedge",
    "grade": "rare",
    "stage": 7,
    "attackPower": 218,
    "successRate": 0.16,
    "failRate": 0.84,
    "failureRewardGroup": "rare_late",
    "nextWeaponId": "rare_08",
    "purchaseUnlockRequired": true,
    "description": "심연으로 꿰뚫는 느낌의 무거운 쐐기형 검."
  },
  {
    "id": "rare_08",
    "nameKo": "흑옥문 개문검",
    "nameEn": "Jade Gate Opener",
    "grade": "rare",
    "stage": 8,
    "attackPower": 248,
    "successRate": 0.12,
    "failRate": 0.88,
    "failureRewardGroup": "rare_final",
    "nextWeaponId": "epic_01",
    "purchaseUnlockRequired": true,
    "description": "에픽의 문을 여는 검으로 설정된 상징적 무기."
  },
  {
    "id": "epic_01",
    "nameKo": "심연의 척추검",
    "nameEn": "Abyss Spine Sword",
    "grade": "epic",
    "stage": 1,
    "attackPower": 285,
    "successRate": 0.28,
    "failRate": 0.72,
    "failureRewardGroup": "epic_early",
    "nextWeaponId": "epic_02",
    "purchaseUnlockRequired": true,
    "description": "심연의 기운이 척추처럼 이어진 검."
  },
  {
    "id": "epic_02",
    "nameKo": "봉인 균열검",
    "nameEn": "Seal-Crack Blade",
    "grade": "epic",
    "stage": 2,
    "attackPower": 325,
    "successRate": 0.22,
    "failRate": 0.78,
    "failureRewardGroup": "epic_early",
    "nextWeaponId": "epic_03",
    "purchaseUnlockRequired": true,
    "description": "봉인이 금 간 흔적이 칼날 전체를 타고 흐른다."
  },
  {
    "id": "epic_03",
    "nameKo": "검혼의 가시",
    "nameEn": "Sword-Soul Thorn",
    "grade": "epic",
    "stage": 3,
    "attackPower": 370,
    "successRate": 0.17,
    "failRate": 0.83,
    "failureRewardGroup": "epic_mid",
    "nextWeaponId": "epic_04",
    "purchaseUnlockRequired": true,
    "description": "검의 혼이 뾰족한 가시처럼 응축된 형태."
  },
  {
    "id": "epic_04",
    "nameKo": "흑옥 심장검",
    "nameEn": "Black-Jade Heartblade",
    "grade": "epic",
    "stage": 4,
    "attackPower": 420,
    "successRate": 0.12,
    "failRate": 0.88,
    "failureRewardGroup": "epic_mid",
    "nextWeaponId": "epic_05",
    "purchaseUnlockRequired": true,
    "description": "흑옥의 심장처럼 뛰는 코어를 가진 검."
  },
  {
    "id": "epic_05",
    "nameKo": "심연의 문지기",
    "nameEn": "Abyss Gatekeeper",
    "grade": "epic",
    "stage": 5,
    "attackPower": 478,
    "successRate": 0.08,
    "failRate": 0.92,
    "failureRewardGroup": "epic_final",
    "nextWeaponId": "legendary_01",
    "purchaseUnlockRequired": true,
    "description": "레전더리로 가는 관문을 지키는 최종 에픽 검."
  },
  {
    "id": "legendary_01",
    "nameKo": "멸겁의 검",
    "nameEn": "Cataclysm Blade",
    "grade": "legendary",
    "stage": 1,
    "attackPower": 560,
    "successRate": 0.15,
    "failRate": 0.85,
    "failureRewardGroup": "legendary_early",
    "nextWeaponId": "legendary_02",
    "purchaseUnlockRequired": true,
    "description": "멸겁의 흔적을 담은 첫 레전더리 검."
  },
  {
    "id": "legendary_02",
    "nameKo": "봉인된 별검",
    "nameEn": "Sealed Star Sword",
    "grade": "legendary",
    "stage": 2,
    "attackPower": 640,
    "successRate": 0.1,
    "failRate": 0.9,
    "failureRewardGroup": "legendary_early",
    "nextWeaponId": "legendary_03",
    "purchaseUnlockRequired": true,
    "description": "별가루가 응고되어 만들어진 검."
  },
  {
    "id": "legendary_03",
    "nameKo": "흑천의 검",
    "nameEn": "Black-Heaven Sword",
    "grade": "legendary",
    "stage": 3,
    "attackPower": 730,
    "successRate": 0.06,
    "failRate": 0.94,
    "failureRewardGroup": "legendary_mid",
    "nextWeaponId": "legendary_04",
    "purchaseUnlockRequired": true,
    "description": "검은 하늘을 베어 만든 듯한 실루엣의 검."
  },
  {
    "id": "legendary_04",
    "nameKo": "태초 봉인검",
    "nameEn": "Primordial Seal Sword",
    "grade": "legendary",
    "stage": 4,
    "attackPower": 840,
    "successRate": 0.03,
    "failRate": 0.97,
    "failureRewardGroup": "legendary_final",
    "nextWeaponId": "final_awakened_sword",
    "purchaseUnlockRequired": true,
    "description": "최종 각성 직전의 마지막 검."
  }
]
